Flavours Mod Events;;;;;;;;;;;;;;;;;;;;;;;x
EVTNAME99801;Deciding a Colonial Policy;;;;;;;;;;;;x,,,,,,,,,,,,,,,,,,,,,,
EVTDESC99801;Now that $COUNTRY$ is a colonial power, it is time to decide a policy of how $COUNTRY_ADJ$ colonial lands will be administered.;;;;;;;;;;;;x,,,,,,,,,,,,,,,,,,,,,,
EVT99801OPTA;Our people need more land to settle!;;;;;;;;;;;;x,,,,,,,,,,,,,,,,,,,,,,
EVT99801OPTB;We shall rule our colonies through local rulers.;;;;;;;;;;;;x,,,,,,,,,,,,,,,,,,,,,,
EVT99801OPTC;It is our burden to bring civilization to these lands.;;;;;;;;;;;;x,,,,,,,,,,,,,,,,,,,,,,